{
  "curriculum": {
    "confidence": "inferred",
    "current": [
      "NC.M1.A-REI.3",
      "NC.M1.F-IF.1",
      "NC.M2.N-RN.2",
      "NC.M2.G-CO.2"
    ],
    "spiral": [
      "linear equations",
      "functions",
      "exponents",
      "transformations"
    ]
  },
  "sections": [
    {
      "id": "monday",
      "questions": [
        {
          "answer": "8x",
          "difficulty": "easy",
          "grade": 9,
          "number": 1,
          "prompt": "Simplify: 3x + 5x.",
          "skill": "combining like terms",
          "verification": {
            "criterion": "Verify 3x + 5x = 8x by combining coefficients",
            "method": "reasoning_review"
          }
        },
        {
          "answer": "5a + 4",
          "difficulty": "easy",
          "grade": 9,
          "number": 2,
          "prompt": "Simplify: 7a - 2a + 4.",
          "skill": "combining like terms",
          "verification": {
            "criterion": "Verify 7a - 2a = 5a, +4 remains",
            "method": "reasoning_review"
          }
        },
        {
          "answer": 17,
          "difficulty": "easy",
          "grade": 9,
          "number": 3,
          "prompt": "Evaluate 2x + 7 when x = 5.",
          "skill": "evaluating expressions",
          "verification": {
            "inputs": {
              "b": 7,
              "m": 2,
              "x": 5
            },
            "method": "linear_eval"
          }
        },
        {
          "answer": 11,
          "difficulty": "easy",
          "grade": 9,
          "number": 4,
          "prompt": "Solve: x + 9 = 20.",
          "skill": "solving equations",
          "verification": {
            "inputs": {
              "expression": "20 - 9"
            },
            "method": "arithmetic_expression"
          }
        },
        {
          "answer": 7,
          "difficulty": "easy",
          "grade": 9,
          "number": 5,
          "prompt": "Solve: 4x = 28.",
          "skill": "solving equations",
          "verification": {
            "inputs": {
              "expression": "28 / 4"
            },
            "method": "arithmetic_expression"
          }
        }
      ],
      "title": "Foundation"
    },
    {
      "id": "tuesday",
      "questions": [
        {
          "answer": 5,
          "difficulty": "medium",
          "grade": 9,
          "number": 6,
          "prompt": "Solve: 3x + 4 = 19.",
          "skill": "solving two-step equations",
          "verification": {
            "inputs": {
              "expression": "(19 - 4) / 3"
            },
            "method": "arithmetic_expression"
          }
        },
        {
          "answer": 5,
          "difficulty": "medium",
          "grade": 9,
          "number": 7,
          "prompt": "Solve: 5x - 7 = 18.",
          "skill": "solving two-step equations",
          "verification": {
            "inputs": {
              "expression": "(18 + 7) / 5"
            },
            "method": "arithmetic_expression"
          }
        },
        {
          "answer": 5,
          "difficulty": "medium",
          "grade": 9,
          "number": 8,
          "prompt": "Solve: 2(x + 3) = 16.",
          "skill": "solving equations with parentheses",
          "verification": {
            "inputs": {
              "expression": "(16 / 2) - 3"
            },
            "method": "arithmetic_expression"
          }
        },
        {
          "answer": "2x + 7 = 25",
          "difficulty": "medium",
          "grade": 9,
          "number": 9,
          "prompt": "Write an equation: Seven more than twice a number is 25.",
          "skill": "translating to algebra",
          "verification": {
            "criterion": "Verify 'twice a number' is 2x, 'seven more' is +7, 'is 25' gives equation",
            "method": "reasoning_review"
          }
        },
        {
          "answer": "C(m) = 4 + 2m or C(m) = 2m + 4",
          "difficulty": "medium",
          "grade": 9,
          "number": 10,
          "prompt": "A taxi charges $4 plus $2 per mile. Write a function C(m) for the cost.",
          "skill": "function modeling",
          "verification": {
            "criterion": "Verify $4 base + $2 per mile m gives C(m) = 4 + 2m",
            "method": "reasoning_review"
          }
        }
      ],
      "title": "Discover"
    },
    {
      "id": "wednesday",
      "questions": [
        {
          "answer": 7,
          "difficulty": "medium",
          "grade": 9,
          "number": 11,
          "prompt": "Solve: 2x + 5 = 3x - 2.",
          "skill": "solving linear equations"
        },
        {
          "answer": 7,
          "difficulty": "medium",
          "grade": 9,
          "number": 12,
          "prompt": "Solve: 4(x - 1) = 2x + 10.",
          "skill": "solving linear equations"
        },
        {
          "answer": "x > 4",
          "difficulty": "medium",
          "grade": 9,
          "number": 13,
          "prompt": "Solve and graph: x + 3 > 7.",
          "skill": "solving inequalities"
        },
        {
          "answer": 16,
          "difficulty": "easy",
          "grade": 10,
          "number": 14,
          "prompt": "Evaluate: 2^4.",
          "skill": "exponents"
        },
        {
          "answer": 27,
          "difficulty": "easy",
          "grade": 10,
          "number": 15,
          "prompt": "Evaluate: 3^3.",
          "skill": "exponents"
        }
      ],
      "title": "Practice"
    },
    {
      "id": "thursday",
      "questions": [
        {
          "answer": "x^5",
          "difficulty": "easy",
          "grade": 10,
          "number": 16,
          "prompt": "Simplify: x^3 \u00b7 x^2.",
          "skill": "exponent rules"
        },
        {
          "answer": "x^4",
          "difficulty": "easy",
          "grade": 10,
          "number": 17,
          "prompt": "Simplify: x^6 \u00f7 x^2.",
          "skill": "exponent rules"
        },
        {
          "answer": 7,
          "difficulty": "easy",
          "grade": 10,
          "number": 18,
          "prompt": "Evaluate: sqrt(49).",
          "skill": "square roots"
        },
        {
          "answer": "x^(1/2)",
          "difficulty": "medium",
          "grade": 10,
          "number": 19,
          "prompt": "Write sqrt(x) using a rational exponent.",
          "skill": "rational exponents"
        },
        {
          "answer": "cube root of x",
          "difficulty": "medium",
          "grade": 10,
          "number": 20,
          "prompt": "Write x^(1/3) using a radical.",
          "skill": "rational exponents"
        }
      ],
      "title": "Apply and Review"
    },
    {
      "id": "friday",
      "questions": [
        {
          "answer": 4,
          "difficulty": "easy",
          "grade": 10,
          "number": 21,
          "prompt": "Evaluate: 16^(1/2).",
          "skill": "rational exponents"
        },
        {
          "answer": 2,
          "difficulty": "medium",
          "grade": 10,
          "number": 22,
          "prompt": "Evaluate: 8^(1/3).",
          "skill": "rational exponents"
        },
        {
          "answer": "6x",
          "difficulty": "medium",
          "grade": 10,
          "number": 23,
          "prompt": "Simplify sqrt(36x^2) for positive x.",
          "skill": "simplifying radicals"
        },
        {
          "answer": "5*sqrt(2)",
          "difficulty": "medium",
          "grade": 10,
          "number": 24,
          "prompt": "Simplify: sqrt(50).",
          "skill": "simplifying radicals"
        },
        {
          "answer": "6*sqrt(2)",
          "difficulty": "medium",
          "grade": 10,
          "number": 25,
          "prompt": "Simplify: sqrt(72).",
          "skill": "simplifying radicals"
        }
      ],
      "title": "Mastery"
    }
  ],
  "verification": {
    "status": "PENDING"
  },
  "worksheet": {
    "duration_minutes": 20,
    "grade": "Grades 9 & 10 Combined",
    "grade_split": {
      "math_1": 13,
      "math_2": 12
    },
    "question_count": 25,
    "week_start": "2026-08-24"
  }
}
